{
  "$schema": "https://json-schema.org/draft/2020-12/schema",
  "$id": "https://schemas.evavo.com.au/studio/animation-source-bundle-v1.schema.json",
  "title": "EVAVO Animation Source Bundle v1",
  "description": "Digest-bound, provider-neutral source media handoff from EVAVO Art Studio to Cel Animation Studio.",
  "type": "object",
  "additionalProperties": false,
  "required": [
    "schema",
    "bundleId",
    "createdAt",
    "producer",
    "project",
    "timeline",
    "canvas",
    "creativeIntentSha256",
    "continuitySha256",
    "assets",
    "authority",
    "bundleDigest",
    "approval"
  ],
  "properties": {
    "schema": {
      "const": "evavo.animation-source-bundle.v1"
    },
    "bundleId": {
      "$ref": "#/$defs/identifier"
    },
    "createdAt": {
      "$ref": "#/$defs/timestamp"
    },
    "producer": {
      "type": "object",
      "additionalProperties": false,
      "required": [
        "studio",
        "version",
        "sourceRevision"
      ],
      "properties": {
        "studio": {
          "const": "evavo-art-studio"
        },
        "version": {
          "type": "string",
          "minLength": 1,
          "maxLength": 64,
          "pattern": "^[A-Za-z0-9][A-Za-z0-9._+-]{0,63}$"
        },
        "sourceRevision": {
          "type": "string",
          "minLength": 1,
          "maxLength": 160,
          "pattern": "^[A-Za-z0-9][A-Za-z0-9._:@+-]{0,159}$"
        }
      }
    },
    "project": {
      "type": "object",
      "additionalProperties": false,
      "required": [
        "projectId",
        "sceneId"
      ],
      "properties": {
        "projectId": {
          "$ref": "#/$defs/identifier"
        },
        "sceneId": {
          "$ref": "#/$defs/identifier"
        },
        "shotId": {
          "$ref": "#/$defs/identifier"
        }
      }
    },
    "timeline": {
      "type": "object",
      "additionalProperties": false,
      "required": [
        "framesPerSecond",
        "startFrame",
        "endFrame",
        "frameCount",
        "cadence",
        "loopMode"
      ],
      "properties": {
        "framesPerSecond": {
          "$ref": "#/$defs/frameRate"
        },
        "startFrame": {
          "type": "integer",
          "minimum": 0,
          "maximum": 100000000
        },
        "endFrame": {
          "type": "integer",
          "minimum": 0,
          "maximum": 100000000
        },
        "frameCount": {
          "type": "integer",
          "minimum": 1,
          "maximum": 100000001
        },
        "cadence": {
          "enum": [
            "ones",
            "twos",
            "threes",
            "mixed"
          ]
        },
        "loopMode": {
          "enum": [
            "none",
            "seamless",
            "finite-repeat"
          ]
        }
      }
    },
    "canvas": {
      "type": "object",
      "additionalProperties": false,
      "required": [
        "width",
        "height",
        "pixelAspectRatio",
        "colourSpace",
        "alphaMode"
      ],
      "properties": {
        "width": {
          "type": "integer",
          "minimum": 1,
          "maximum": 16384
        },
        "height": {
          "type": "integer",
          "minimum": 1,
          "maximum": 16384
        },
        "pixelAspectRatio": {
          "$ref": "#/$defs/pixelAspectRatio"
        },
        "colourSpace": {
          "type": "string",
          "minLength": 1,
          "maxLength": 96
        },
        "alphaMode": {
          "enum": [
            "straight",
            "premultiplied",
            "opaque"
          ]
        }
      }
    },
    "creativeIntentSha256": {
      "$ref": "#/$defs/sha256"
    },
    "continuitySha256": {
      "$ref": "#/$defs/sha256"
    },
    "assets": {
      "type": "array",
      "minItems": 1,
      "maxItems": 4096,
      "items": {
        "$ref": "#/$defs/asset"
      }
    },
    "authority": {
      "type": "object",
      "additionalProperties": false,
      "required": [
        "candidateOnly",
        "providerExecution",
        "renderExecution",
        "xSheetAuthority",
        "creativeApprovalIncluded",
        "publication",
        "repositoryMutation"
      ],
      "properties": {
        "candidateOnly": {
          "const": true
        },
        "providerExecution": {
          "const": false
        },
        "renderExecution": {
          "const": false
        },
        "xSheetAuthority": {
          "const": "cel-animation-studio"
        },
        "creativeApprovalIncluded": {
          "type": "boolean"
        },
        "publication": {
          "const": false
        },
        "repositoryMutation": {
          "const": false
        }
      }
    },
    "bundleDigest": {
      "$ref": "#/$defs/sha256"
    },
    "approval": {
      "$ref": "#/$defs/approval"
    }
  },
  "$defs": {
    "identifier": {
      "type": "string",
      "minLength": 1,
      "maxLength": 128,
      "pattern": "^[A-Za-z0-9][A-Za-z0-9._:-]{0,127}$"
    },
    "sha256": {
      "type": "string",
      "pattern": "^sha256:[0-9a-f]{64}$"
    },
    "artifactId": {
      "type": "string",
      "pattern": "^artifact_[0-9a-f]{64}$"
    },
    "timestamp": {
      "type": "string",
      "pattern": "^\\d{4}-\\d{2}-\\d{2}T\\d{2}:\\d{2}:\\d{2}\\.\\d{3}Z$"
    },
    "relativePath": {
      "type": "string",
      "minLength": 1,
      "maxLength": 1024,
      "pattern": "^(?!/)(?![A-Za-z]:)(?!.*\\\\\\\\)(?!.*//)(?!.*(?:^|/)\\.\\.?(?:/|$))[^\\u0000-\\u001f\\u007f]+$"
    },
    "frameRate": {
      "type": "object",
      "additionalProperties": false,
      "required": [
        "numerator",
        "denominator"
      ],
      "properties": {
        "numerator": {
          "type": "integer",
          "minimum": 1,
          "maximum": 240000
        },
        "denominator": {
          "type": "integer",
          "minimum": 1,
          "maximum": 1001
        }
      }
    },
    "pixelAspectRatio": {
      "type": "object",
      "additionalProperties": false,
      "required": [
        "numerator",
        "denominator"
      ],
      "properties": {
        "numerator": {
          "type": "integer",
          "minimum": 1,
          "maximum": 10000
        },
        "denominator": {
          "type": "integer",
          "minimum": 1,
          "maximum": 10000
        }
      }
    },
    "asset": {
      "type": "object",
      "additionalProperties": false,
      "required": [
        "assetId",
        "role",
        "relativePath",
        "mediaType",
        "byteLength",
        "sha256"
      ],
      "dependentRequired": {
        "width": [
          "height"
        ],
        "height": [
          "width"
        ]
      },
      "properties": {
        "assetId": {
          "$ref": "#/$defs/identifier"
        },
        "role": {
          "enum": [
            "canonical-identity",
            "direction-master",
            "model-sheet",
            "layout",
            "background",
            "foreground",
            "key-pose",
            "breakdown",
            "inbetween",
            "cel",
            "effects",
            "matte",
            "reference"
          ]
        },
        "relativePath": {
          "$ref": "#/$defs/relativePath"
        },
        "mediaType": {
          "type": "string",
          "minLength": 3,
          "maxLength": 191,
          "pattern": "^[a-z0-9][a-z0-9!#$&^_.+-]{0,63}/[a-z0-9][a-z0-9!#$&^_.+-]{0,126}$"
        },
        "byteLength": {
          "type": "integer",
          "minimum": 1,
          "maximum": 9007199254740991
        },
        "sha256": {
          "$ref": "#/$defs/sha256"
        },
        "width": {
          "type": "integer",
          "minimum": 1,
          "maximum": 16384
        },
        "height": {
          "type": "integer",
          "minimum": 1,
          "maximum": 16384
        },
        "frameNumber": {
          "type": "integer",
          "minimum": 0,
          "maximum": 100000000
        },
        "layerId": {
          "$ref": "#/$defs/identifier"
        },
        "sourceArtifactId": {
          "$ref": "#/$defs/artifactId"
        }
      }
    },
    "approval": {
      "oneOf": [
        {
          "type": "object",
          "additionalProperties": false,
          "required": [
            "state",
            "approvalDigest"
          ],
          "properties": {
            "state": {
              "const": "draft"
            },
            "approvalDigest": {
              "$ref": "#/$defs/sha256"
            }
          }
        },
        {
          "type": "object",
          "additionalProperties": false,
          "required": [
            "state",
            "approvedBundleDigest",
            "approvedBy",
            "approvedAt",
            "decisionReason",
            "approvalDigest"
          ],
          "properties": {
            "state": {
              "const": "approved"
            },
            "approvedBundleDigest": {
              "$ref": "#/$defs/sha256"
            },
            "approvedBy": {
              "$ref": "#/$defs/identifier"
            },
            "approvedAt": {
              "$ref": "#/$defs/timestamp"
            },
            "decisionReason": {
              "type": "string",
              "minLength": 8,
              "maxLength": 1024
            },
            "approvalDigest": {
              "$ref": "#/$defs/sha256"
            }
          }
        },
        {
          "type": "object",
          "additionalProperties": false,
          "required": [
            "state",
            "decisionReason",
            "approvalDigest"
          ],
          "properties": {
            "state": {
              "const": "rejected"
            },
            "decisionReason": {
              "type": "string",
              "minLength": 8,
              "maxLength": 1024
            },
            "approvalDigest": {
              "$ref": "#/$defs/sha256"
            }
          }
        }
      ]
    }
  }
}
